{
  "slug": "knocked-up",
  "title": "Knocked Up",
  "year": 2007,
  "runtime_min": 129,
  "score": 22,
  "score_note": "the rare comedy that keeps the marriage in frame",
  "order": ["ben", "alison", "debbie", "pete", "friends"],
  "chars": [
    {"id": "ben", "name": "Ben", "width": 33, "colour": "#1b57c4"},
    {"id": "alison", "name": "Alison", "width": 33, "colour": "#d0316a"},
    {"id": "debbie", "name": "Debbie", "width": 26, "colour": "#6e9078"},
    {"id": "pete", "name": "Pete", "width": 26, "colour": "#9c6552"},
    {"id": "friends", "name": "the friends", "width": 20, "colour": "#b09a4e"}
  ],
  "beats": [
    {
      "name": "THE NIGHTCLUB",
      "loc": "≈ 8–18 min",
      "cap": ["alison meets ben at a club the night of her",
              "promotion; they drink and sleep together"],
      "tag": "MEET-CUTE — the whole premise in one night",
      "cats": ["meet"],
      "clusters": [["ben"], ["alison"]],
      "enter": ["ben", "alison"]
    },
    {
      "name": "THE MORNING AFTER",
      "loc": "≈ 18–28 min",
      "cap": ["over breakfast they find they have nothing",
              "in common; ben goes home disappointed"],
      "tag": "FALSE ENDING — no reason to stay",
      "cats": [],
      "clusters": [["ben", "alison"]]
    },
    {
      "name": "EIGHT WEEKS LATER",
      "loc": "≈ 28–38 min",
      "cap": ["alison's morning sickness hits during an",
              "interview, and she learns she is pregnant"],
      "tag": "DISCOVERY — one night becomes nine months",
      "cats": [],
      "clusters": [["alison"]]
    },
    {
      "name": "BEN SIGNS ON",
      "loc": "≈ 38–50 min",
      "cap": ["alison calls ben; he shows up for the",
              "doctor's appointments and tries to help"],
      "tag": "GESTURE — the slacker turns up anyway",
      "cats": ["gesture"],
      "clusters": [["ben", "alison"]]
    },
    {
      "name": "MEETING THE FAMILY",
      "loc": "≈ 50–62 min",
      "cap": ["ben meets debbie and pete, alison's sister",
              "and brother-in-law, and bonds with pete"],
      "tag": "BFF — the friendship that carries the B plot",
      "cats": ["bff"],
      "clusters": [["ben", "alison"], ["debbie", "pete"]],
      "enter": ["debbie", "pete"]
    },
    {
      "name": "THE ROOMMATES",
      "loc": "≈ 62–70 min",
      "cap": ["ben's jobless roommates run a celebrity",
              "nudity website and mock his new life"],
      "tag": "BFF — the friends he has to grow past",
      "cats": ["bff"],
      "clusters": [["ben", "friends"]],
      "enter": ["friends"]
    },
    {
      "name": "DEBBIE'S SUSPICIONS",
      "loc": "≈ 70–82 min",
      "cap": ["debbie suspects pete is cheating and their",
              "marriage comes apart beside the romance"],
      "tag": "OBSTACLE — the marriage in the next room",
      "cats": [],
      "clusters": [["debbie", "pete"], ["ben", "alison"]]
    },
    {
      "name": "VEGAS WITHOUT HER",
      "loc": "≈ 82–95 min",
      "cap": ["ben goes to las vegas with pete for the",
              "fantasy baseball draft, leaving alison"],
      "tag": "ESCAPADE — pete's escape hatch, lent out",
      "cats": [],
      "clusters": [["ben", "pete"], ["alison", "debbie"]]
    },
    {
      "name": "THE SPLIT",
      "loc": "≈ 95–110 min",
      "cap": ["ben and alison break up, and debbie and",
              "pete's marriage is falling apart too"],
      "tag": "BREAKUP — the middle act's whole point",
      "cats": ["breakup", "ebert"],
      "clusters": [["ben"], ["alison"], ["debbie"], ["pete"]]
    },
    {
      "name": "BEN GROWS UP",
      "loc": "≈ 110–120 min",
      "cap": ["ben reads up on pregnancy with his friends",
              "and finds a place of his own to be ready"],
      "tag": "TURN — the slacker starts to show up",
      "cats": ["gesture"],
      "clusters": [["ben", "friends"], ["alison", "debbie"]],
      "stubs": ["friends"]
    },
    {
      "name": "THE BIRTH",
      "loc": "the coda",
      "cap": ["alison goes into labor; ben reaches the",
              "hospital and stays for the birth"],
      "tag": "END — a family of a kind nobody planned",
      "cats": ["ebert"],
      "clusters": [["ben", "alison"]]
    }
  ]
}
