{
  "slug": "silver-linings-playbook",
  "title": "Silver Linings Playbook",
  "year": 2012,
  "runtime_min": 122,
  "score": 26,
  "order": [
    "pat",
    "tiffany",
    "patsr",
    "dolores",
    "cliff",
    "ronnie",
    "danny"
  ],
  "chars": [
    {
      "id": "pat",
      "name": "Pat",
      "width": 34,
      "colour": "#1b57c4"
    },
    {
      "id": "tiffany",
      "name": "Tiffany",
      "width": 32,
      "colour": "#d0316a"
    },
    {
      "id": "patsr",
      "name": "Pat Sr.",
      "width": 24,
      "colour": "#6e9078"
    },
    {
      "id": "dolores",
      "name": "Dolores",
      "width": 18,
      "colour": "#9c6552"
    },
    {
      "id": "cliff",
      "name": "Cliff",
      "width": 16,
      "colour": "#b09a4e"
    },
    {
      "id": "ronnie",
      "name": "Ronnie",
      "width": 15,
      "colour": "#8d7fa8"
    },
    {
      "id": "danny",
      "name": "Danny",
      "width": 14,
      "colour": "#6f8f96"
    }
  ],
  "beats": [
    {
      "name": "OUT OF THE FACILITY",
      "loc": "\u2248 0\u201310 min",
      "cap": [
        "Pat comes home after eight months; Nikki",
        "has a restraining order and he has a plan"
      ],
      "tag": "OPENING \u2014 a man rebuilding on a broken plan",
      "cats": [],
      "clusters": [
        [
          "pat",
          "dolores"
        ],
        [
          "patsr"
        ]
      ],
      "enter": [
        "pat",
        "dolores",
        "patsr"
      ]
    },
    {
      "name": "CLIFF'S OFFICE",
      "loc": "\u2248 10\u201318 min",
      "cap": [
        "His therapist Cliff wants him back on the",
        "medication; Pat insists that he is fine"
      ],
      "tag": "ROUTINE \u2014 the help he keeps refusing",
      "cats": [],
      "clusters": [
        [
          "pat",
          "cliff"
        ]
      ],
      "enter": [
        "cliff"
      ]
    },
    {
      "name": "DINNER AT RONNIE'S",
      "loc": "\u2248 20\u201328 min",
      "cap": [
        "At his best friend's dinner Pat meets",
        "Tiffany, a widow, and they swap diagnoses"
      ],
      "tag": "MEET-CUTE \u2014 two griefs comparing notes",
      "cats": [
        "meet"
      ],
      "clusters": [
        [
          "pat",
          "ronnie"
        ],
        [
          "tiffany"
        ]
      ],
      "enter": [
        "tiffany",
        "ronnie"
      ]
    },
    {
      "name": "THE DEAL",
      "loc": "\u2248 28\u201338 min",
      "cap": [
        "Tiffany offers to carry letters to Nikki if",
        "Pat trains with her for a dance contest"
      ],
      "tag": "THE DEAL \u2014 a favour that is really a bet",
      "cats": [],
      "clusters": [
        [
          "pat",
          "tiffany"
        ]
      ]
    },
    {
      "name": "THE STUDIO",
      "loc": "\u2248 38\u201358 min",
      "cap": [
        "They rehearse the routine after hours; he",
        "reads Nikki's letters and starts to change"
      ],
      "tag": "TRAINING \u2014 the two of them, getting better",
      "cats": [
        "chem"
      ],
      "clusters": [
        [
          "pat",
          "tiffany"
        ]
      ]
    },
    {
      "name": "DANNY TURNS UP",
      "loc": "\u2248 58\u201366 min",
      "cap": [
        "Danny, his friend from the ward, shows up",
        "at the house and pushes him to keep going"
      ],
      "tag": "BEST FRIEND \u2014 the one who got out first",
      "cats": [
        "bff"
      ],
      "clusters": [
        [
          "pat",
          "danny"
        ]
      ],
      "enter": [
        "danny"
      ]
    },
    {
      "name": "PAT SR.'S PARLAY",
      "loc": "\u2248 66\u201378 min",
      "cap": [
        "Pat's father bets the family money on the",
        "Eagles and on his son's dance score"
      ],
      "tag": "SUBPLOT \u2014 the father's superstition and debt",
      "cats": [],
      "clusters": [
        [
          "patsr",
          "dolores"
        ],
        [
          "pat"
        ]
      ]
    },
    {
      "name": "THE SUNDAY BLOW-UP",
      "loc": "\u2248 78\u201390 min",
      "cap": [
        "Game day ends in shouting between Pat and",
        "his father; Tiffany walks out of the house"
      ],
      "tag": "FIGHT \u2014 everyone convinced they are right",
      "cats": [],
      "clusters": [
        [
          "pat",
          "tiffany"
        ],
        [
          "patsr",
          "dolores"
        ]
      ]
    },
    {
      "name": "THE LETTER",
      "loc": "\u2248 90\u201398 min",
      "cap": [
        "Cliff points out that the letter signed by",
        "Nikki is Tiffany's handwriting and work"
      ],
      "tag": "REVEAL \u2014 the letters were Tiffany's all along",
      "cats": [],
      "clusters": [
        [
          "pat",
          "cliff"
        ]
      ]
    },
    {
      "name": "PAT RUNS",
      "loc": "\u2248 98\u2013104 min",
      "cap": [
        "Pat runs through the streets looking for",
        "Tiffany, who has gone missing since the row"
      ],
      "tag": "GESTURE \u2014 the first thing he has chased",
      "cats": [
        "gesture"
      ],
      "clusters": [
        [
          "pat"
        ]
      ]
    },
    {
      "name": "FIVE POINTS",
      "loc": "\u2248 104\u2013118 min",
      "cap": [
        "They perform the routine; the judges hold",
        "up a 5, and the parlay comes down to it"
      ],
      "tag": "CLIMAX \u2014 the number that settles the bet",
      "cats": [
        "chem"
      ],
      "clusters": [
        [
          "pat",
          "tiffany"
        ],
        [
          "patsr",
          "dolores"
        ]
      ]
    },
    {
      "name": "THE SILVER LINING",
      "loc": "the coda",
      "cap": [
        "Pat stops trying to win Nikki back and",
        "stays with Tiffany; the bet pays off"
      ],
      "tag": "ENDING \u2014 the silver lining chosen out loud",
      "cats": [
        "breakup"
      ],
      "clusters": [
        [
          "pat",
          "tiffany"
        ]
      ]
    }
  ]
}
