{
  "slug": "isn-t-it-romantic",
  "title": "Isn't It Romantic",
  "year": 2019,
  "runtime_min": 88,
  "score": 21,
  "score_note": "the parody earns the categories it is taking apart",
  "order": ["natalie", "josh", "blake", "whitney", "donny", "isabella"],
  "chars": [
    {"id": "natalie",  "name": "Natalie",  "width": 34, "colour": "#1b57c4"},
    {"id": "josh",     "name": "Josh",     "width": 30, "colour": "#d0316a"},
    {"id": "blake",    "name": "Blake",    "width": 24, "colour": "#6e9078"},
    {"id": "whitney",  "name": "Whitney",  "width": 20, "colour": "#9c6552"},
    {"id": "donny",    "name": "Donny",    "width": 18, "colour": "#b09a4e"},
    {"id": "isabella", "name": "Isabella", "width": 14, "colour": "#8d7fa8"}
  ],
  "beats": [
    {
      "name": "THE LESSON",
      "loc": "≈ 0–6 min",
      "cap": ["a girl is told love is for other people",
              "and grows up believing it"],
      "tag": "SETUP — where the rule comes from",
      "cats": [],
      "clusters": [["natalie"]],
      "enter": ["natalie"]
    },
    {
      "name": "THE ARCHITECT WHO ISN'T",
      "loc": "≈ 6–16 min",
      "cap": ["Natalie draws plans nobody signs,",
              "while Whitney defends the genre"],
      "tag": "STRUCTURE — the office she can't hold",
      "cats": [],
      "clusters": [["natalie"], ["whitney"], ["josh"]],
      "enter": ["whitney", "josh"]
    },
    {
      "name": "THE MUGGING",
      "loc": "≈ 16–24 min",
      "cap": ["a stranger flirts; she is knocked out",
              "and wakes up inside a rom-com"],
      "tag": "STRUCTURE — the fall into the trope",
      "cats": [],
      "clusters": [["natalie"]]
    },
    {
      "name": "WAKING UP IN THE PENTHOUSE",
      "loc": "≈ 24–32 min",
      "cap": ["she wakes in a penthouse and a billionaire",
              "is already in love with her"],
      "tag": "MEET-CUTE — the genre hands her a man",
      "cats": ["meet"],
      "clusters": [["natalie", "blake"]],
      "enter": ["blake"]
    },
    {
      "name": "THE GAY BEST FRIEND NEXT DOOR",
      "loc": "≈ 32–40 min",
      "cap": ["Donny, once a misogynist, is now",
              "the best friend with all the advice"],
      "tag": "BFF — the trope supplies a confidant",
      "cats": ["bff"],
      "clusters": [["natalie"], ["donny"]],
      "enter": ["donny"]
    },
    {
      "name": "JOSH IS ENGAGED",
      "loc": "≈ 40–48 min",
      "cap": ["Josh is engaged to Isabella, and",
              "Natalie finds she wanted him"],
      "tag": "CHEMISTRY — she finally sees her friend",
      "cats": ["chem"],
      "clusters": [["natalie"], ["josh", "isabella"]],
      "enter": ["isabella"],
      "stubs": ["isabella"]
    },
    {
      "name": "BLAKE'S COURTSHIP",
      "loc": "≈ 48–58 min",
      "cap": ["Blake stages the courtship in songs and",
              "slow motion; she feels nothing"],
      "tag": "STRUCTURE — a seduction with no substance",
      "cats": [],
      "clusters": [["natalie", "blake"]]
    },
    {
      "name": "THE FANTASY BREAKS",
      "loc": "≈ 58–68 min",
      "cap": ["the fantasy sours; she sends Blake",
              "away and stops believing it"],
      "tag": "BREAKUP — the trope turns on her",
      "cats": [],
      "clusters": [["natalie"], ["blake"]]
    },
    {
      "name": "BACK IN THE REAL WORLD",
      "loc": "≈ 68–78 min",
      "cap": ["she wakes with the nerve she never",
              "had and pitches her own plan"],
      "tag": "STRUCTURE — the fantasy lets go",
      "cats": [],
      "clusters": [["natalie"], ["blake"], ["whitney"]]
    },
    {
      "name": "THE REFLECTION",
      "loc": "≈ 78–85 min",
      "cap": ["Josh was never watching the billboard;",
              "he was watching her reflection"],
      "tag": "GESTURE — the confession she can hear",
      "cats": [],
      "clusters": [["natalie", "josh"]]
    },
    {
      "name": "THE SONG",
      "loc": "the coda",
      "cap": ["the cast admits they have been inside",
              "a romantic comedy the whole time"],
      "tag": "EBERT — the film names its own machine",
      "cats": ["ebert"],
      "clusters": [["natalie", "josh"], ["whitney"], ["donny"], ["blake"]]
    }
  ]
}
