{
  "slug": "the-lake-house",
  "title": "The Lake House",
  "year": 2006,
  "runtime_min": 99,
  "score": 19,
  "score_note": "two letters, one mailbox: the leads share a year only at the end",
  "legend_object": "the mailbox",
  "order": ["kate", "alex", "morgan", "simon"],
  "chars": [
    {"id": "kate", "name": "Kate", "width": 34, "colour": "#1b57c4"},
    {"id": "alex", "name": "Alex", "width": 32, "colour": "#d0316a"},
    {"id": "morgan", "name": "Morgan", "width": 24, "colour": "#6e9078"},
    {"id": "simon", "name": "Simon", "width": 18, "colour": "#9c6552"}
  ],
  "beats": [
    {
      "name": "THE LETTER IN THE MAILBOX",
      "loc": "≈ 0–12 min",
      "cap": ["kate leaves a note in 2006; two years",
              "earlier, alex finds it and writes back"],
      "tag": "MEET-CUTE — the mailbox introduces them",
      "cats": ["meet"],
      "clusters": [["kate"], ["alex"]],
      "enter": ["kate", "alex"]
    },
    {
      "name": "THE PAWPRINTS",
      "loc": "≈ 12–20 min",
      "cap": ["alex's dog runs through the wet paint and",
              "leaves the marks kate's note described"],
      "tag": "STRUCTURE — the house makes the letter true",
      "cats": [],
      "clusters": [["alex"]]
    },
    {
      "name": "VALENTINE'S DAY",
      "loc": "≈ 20–30 min",
      "cap": ["kate fails to save a stranger struck",
              "by a car in daley plaza"],
      "tag": "STRUCTURE — a death the film will return to",
      "cats": [],
      "clusters": [["kate"]]
    },
    {
      "name": "TWO YEARS APART",
      "loc": "≈ 30–45 min",
      "cap": ["the letters cross two years in a day;",
              "they work out they live in different ones"],
      "tag": "CHEMISTRY — a courtship at the speed of post",
      "cats": ["chem"],
      "clusters": [["kate"], ["alex"]]
    },
    {
      "name": "PERSUASION",
      "loc": "≈ 45–55 min",
      "cap": ["kate asks alex to find the austen novel",
              "she left behind at the train station"],
      "tag": "GESTURE — a book carried across two years",
      "cats": ["gesture"],
      "clusters": [["kate"], ["alex"]]
    },
    {
      "name": "THE ARCHITECTURE WALK",
      "loc": "≈ 55–68 min",
      "cap": ["alex maps the chicago buildings he loves;",
              "kate walks the route two years later"],
      "tag": "CHEMISTRY — a date assembled out of letters",
      "cats": [],
      "clusters": [["kate"], ["alex"]]
    },
    {
      "name": "ALEX'S FATHER",
      "loc": "≈ 55–70 min",
      "cap": ["alex's architect father simon is dying,",
              "while alex restores the lake house"],
      "tag": "STRUCTURE — the family strand the film keeps",
      "cats": [],
      "clusters": [["alex", "simon"]],
      "enter": ["simon"],
      "stubs": ["simon"]
    },
    {
      "name": "THE BIRTHDAY PARTY",
      "loc": "≈ 70–80 min",
      "cap": ["at kate's party, thrown by morgan, alex",
              "kisses her and says nothing of the letters"],
      "tag": "STRUCTURE — the one night the two years touch",
      "cats": [],
      "clusters": [["kate", "morgan"], ["alex"]],
      "enter": ["morgan"],
      "stubs": ["morgan"]
    },
    {
      "name": "THE MAN SHE SAW",
      "loc": "≈ 80–88 min",
      "cap": ["kate realizes the man who died in the",
              "road was alex, coming to meet her"],
      "tag": "STRUCTURE — she learns what the letters cost",
      "cats": [],
      "clusters": [["kate"]]
    },
    {
      "name": "DON'T COME",
      "loc": "≈ 88–94 min",
      "cap": ["kate writes to stop alex crossing the",
              "road; he obeys and waits two years"],
      "tag": "GESTURE — obeying a letter that saves him",
      "cats": ["gesture"],
      "clusters": [["kate"], ["alex"]]
    },
    {
      "name": "THE LAKE HOUSE, AGAIN",
      "loc": "the coda",
      "cap": ["kate comes back to the lake house and",
              "alex is there, waiting in her own year"],
      "tag": "STRUCTURE — the two timelines finally meet",
      "cats": [],
      "clusters": [["kate", "alex"]]
    }
  ]
}
