{
  "slug": "the-lovebirds",
  "title": "The Lovebirds",
  "year": 2020,
  "runtime_min": 87,
  "score": 19,
  "score_note": "a mid-table rom-com carried by its two leads",
  "order": [
    "jibran",
    "leilani",
    "mustache",
    "edie",
    "brett",
    "bicycle"
  ],
  "chars": [
    {
      "id": "jibran",
      "name": "Jibran",
      "width": 32,
      "colour": "#1b57c4"
    },
    {
      "id": "leilani",
      "name": "Leilani",
      "width": 31,
      "colour": "#d0316a"
    },
    {
      "id": "mustache",
      "name": "Mustache",
      "width": 24,
      "colour": "#6e9078"
    },
    {
      "id": "edie",
      "name": "Edie",
      "width": 20,
      "colour": "#9c6552"
    },
    {
      "id": "brett",
      "name": "Brett",
      "width": 18,
      "colour": "#b09a4e"
    },
    {
      "id": "bicycle",
      "name": "Bicycle",
      "width": 14,
      "colour": "#8d7fa8"
    }
  ],
  "beats": [
    {
      "name": "FOUR YEARS IN",
      "loc": "≈ 0–6 min",
      "cap": [
        "together four years, they argue about everything",
        "driving to a party, they agree to end it"
      ],
      "tag": "THE BREAKUP — decided in the car",
      "cats": [
        "breakup"
      ],
      "clusters": [
        [
          "jibran",
          "leilani"
        ]
      ],
      "enter": [
        "jibran",
        "leilani"
      ]
    },
    {
      "name": "THE RED LIGHT",
      "loc": "≈ 6–12 min",
      "cap": [
        "distracted, Jibran runs a red light",
        "he hits a cyclist who refuses help and flees"
      ],
      "tag": "THE ACCIDENT — the night turns",
      "cats": [],
      "clusters": [
        [
          "jibran",
          "leilani"
        ],
        [
          "bicycle"
        ]
      ],
      "enter": [
        "bicycle"
      ]
    },
    {
      "name": "MUSTACHE",
      "loc": "≈ 12–18 min",
      "cap": [
        "a stranger commandeers the car as police",
        "he runs the cyclist down and kills him"
      ],
      "tag": "THE MURDER — they are witnesses now",
      "cats": [],
      "clusters": [
        [
          "jibran",
          "leilani",
          "mustache"
        ],
        [
          "bicycle"
        ]
      ],
      "stubs": [
        "bicycle"
      ]
    },
    {
      "name": "ON THE RUN",
      "loc": "≈ 18–24 min",
      "cap": [
        "he wants them to turn themselves in",
        "she says bias will convict them instead"
      ],
      "tag": "THE FLIGHT — they run, they don't call",
      "cats": [],
      "clusters": [
        [
          "jibran",
          "leilani"
        ]
      ]
    },
    {
      "name": "EDIE AT THE BAR",
      "loc": "≈ 24–32 min",
      "cap": [
        "the dead man's phone sets a meeting with Edie",
        "the bar meeting turns out to be a setup"
      ],
      "tag": "THE LEAD — a name on a dead man's phone",
      "cats": [],
      "clusters": [
        [
          "jibran",
          "leilani"
        ],
        [
          "edie"
        ]
      ],
      "enter": [
        "edie"
      ]
    },
    {
      "name": "TIED UP",
      "loc": "≈ 32–40 min",
      "cap": [
        "Edie and Brett knock them out and tie them up",
        "Edie thinks the pair work for Bicycle"
      ],
      "tag": "THE CAPTURE — blackmail, wrong suspects",
      "cats": [],
      "clusters": [
        [
          "jibran",
          "leilani"
        ],
        [
          "edie",
          "brett"
        ]
      ],
      "enter": [
        "brett"
      ]
    },
    {
      "name": "THE ESCAPE",
      "loc": "≈ 40–47 min",
      "cap": [
        "as Edie turns to torture, they break free",
        "they flee with one of Bicycle's envelopes"
      ],
      "tag": "THE ESCAPE — they take the blackmail",
      "cats": [],
      "clusters": [
        [
          "jibran",
          "leilani"
        ],
        [
          "edie",
          "brett"
        ]
      ],
      "stubs": [
        "edie",
        "brett"
      ]
    },
    {
      "name": "THE FRAT APARTMENT",
      "loc": "≈ 47–57 min",
      "cap": [
        "the address leads to a flat of frat boys",
        "one confesses the scheme; Mustache kills them"
      ],
      "tag": "THE LEAD — then the hunter burns it",
      "cats": [],
      "clusters": [
        [
          "jibran",
          "leilani"
        ],
        [
          "mustache"
        ]
      ]
    },
    {
      "name": "THE MASQUERADE",
      "loc": "≈ 57–70 min",
      "cap": [
        "a masked black-tie meeting matches the photos",
        "the leader spots the impostors; a raid hits"
      ],
      "tag": "THE RITUAL — a secret society, then police",
      "cats": [],
      "clusters": [
        [
          "jibran",
          "leilani"
        ]
      ]
    },
    {
      "name": "DETECTIVE MARTIN",
      "loc": "≈ 70–78 min",
      "cap": [
        "Detective Martin says they were witnesses",
        "the ride home is driven by Mustache"
      ],
      "tag": "THE REVEAL — the cop is the killer",
      "cats": [],
      "clusters": [
        [
          "jibran",
          "leilani"
        ],
        [
          "mustache"
        ]
      ]
    },
    {
      "name": "THE STRUGGLE",
      "loc": "≈ 78–85 min",
      "cap": [
        "Leilani shoots Mustache; he is arrested",
        "Jibran and Leilani reconcile and kiss"
      ],
      "tag": "THE TURN — they fight back together",
      "cats": [
        "chem",
        "gesture"
      ],
      "clusters": [
        [
          "jibran",
          "leilani"
        ],
        [
          "mustache"
        ]
      ],
      "stubs": [
        "mustache"
      ]
    },
    {
      "name": "ONE YEAR LATER",
      "loc": "the coda",
      "cap": [
        "a year on, they race on The Amazing Race",
        "the relationship is tested once more"
      ],
      "tag": "THE CODA — together, still arguing",
      "cats": [],
      "clusters": [
        [
          "jibran",
          "leilani"
        ]
      ]
    }
  ]
}