{
  "slug": "palm-springs",
  "title": "Palm Springs",
  "year": 2020,
  "runtime_min": 90,
  "score": 28,
  "score_note": "top band: the meet, the pairing and the split all fire in one day",
  "order": ["nyles", "sarah", "roy", "misty", "tala", "howard", "abe"],
  "chars": [
    {"id": "nyles", "name": "Nyles", "width": 32, "colour": "#1b57c4"},
    {"id": "sarah", "name": "Sarah", "width": 32, "colour": "#d0316a"},
    {"id": "roy", "name": "Roy", "width": 20, "colour": "#6e9078"},
    {"id": "misty", "name": "Misty", "width": 16, "colour": "#9c6552"},
    {"id": "tala", "name": "Tala", "width": 15, "colour": "#b09a4e"},
    {"id": "howard", "name": "Howard", "width": 14, "colour": "#8d7fa8"},
    {"id": "abe", "name": "Abe", "width": 14, "colour": "#6f8f96"}
  ],
  "beats": [
    {
      "name": "THE WEDDING DAY",
      "loc": "≈ 0–10 min",
      "cap": ["Nyles wakes beside Misty on Tala's wedding day",
              "He gives the reception a rambling, hollow toast"],
      "tag": "MEET — the day that will not end begins",
      "cats": ["meet"],
      "clusters": [["nyles", "misty"], ["sarah"], ["tala", "abe"], ["howard"]],
      "enter": ["nyles", "sarah", "misty", "tala", "abe", "howard"]
    },
    {
      "name": "FIRST TALK",
      "loc": "≈ 10–20 min",
      "cap": ["Nyles pulls Sarah away from a drunk guest",
              "They talk all night, then walk out to the desert"],
      "tag": "CHEMISTRY — the one good night before the loop",
      "cats": ["chem"],
      "clusters": [["nyles", "sarah"], ["misty"], ["tala", "abe"], ["howard"]]
    },
    {
      "name": "THE CAVE",
      "loc": "≈ 20–28 min",
      "cap": ["Nyles walks into a glowing desert cave",
              "Sarah follows him in and wakes on the same morning"],
      "tag": "THE LOOP — the day starts over",
      "cats": [],
      "clusters": [["nyles", "sarah"]]
    },
    {
      "name": "THE TWO OF THEM",
      "loc": "≈ 28–40 min",
      "cap": ["Nyles teaches Sarah how the repeating day works",
              "They drink and misbehave through the same hours"],
      "tag": "PAIRING — the same two lanes, over and over",
      "cats": ["bff"],
      "clusters": [["nyles", "sarah"]]
    },
    {
      "name": "THE ARROWS",
      "loc": "≈ 40–48 min",
      "cap": ["Roy has been in the loop longer than Nyles",
              "He hunts Nyles with a bow and shoots him dead"],
      "tag": "THE RULE — the loop has been running for years",
      "cats": [],
      "clusters": [["nyles", "sarah"], ["roy"]],
      "enter": ["roy"]
    },
    {
      "name": "THE CONFESSION",
      "loc": "≈ 48–56 min",
      "cap": ["Sarah confesses she slept with the groom, Abe",
              "Nyles shrugs: nothing done here can count"],
      "tag": "CONFESSION — the day's worst thing, said aloud",
      "cats": [],
      "clusters": [["nyles", "sarah"], ["tala", "abe"], ["howard"]]
    },
    {
      "name": "THE SPLIT",
      "loc": "≈ 56–64 min",
      "cap": ["Sarah wants to break the loop; Nyles wants to stay",
              "He has stopped wanting his old life back"],
      "tag": "BREAKUP — they want different forevers",
      "cats": ["breakup"],
      "clusters": [["nyles"], ["sarah"], ["misty"]]
    },
    {
      "name": "NOTHING STICKS",
      "loc": "≈ 64–70 min",
      "cap": ["Sarah tries everything to end the day early",
              "Even dying returns her to the same morning"],
      "tag": "THE RULE — force cannot break the day",
      "cats": [],
      "clusters": [["nyles", "sarah"], ["roy"]]
    },
    {
      "name": "THE BOMB",
      "loc": "≈ 70–78 min",
      "cap": ["Sarah finds a bomb and they plan a joint exit",
              "They will go out together, hands held"],
      "tag": "THE PLAN — the only exit they can share",
      "cats": [],
      "clusters": [["nyles", "sarah"], ["misty"], ["tala", "abe"]]
    },
    {
      "name": "THE DANCE FLOOR",
      "loc": "≈ 78–85 min",
      "cap": ["Nyles says what he means at the reception",
              "They hold hands and the bomb goes off"],
      "tag": "CLIMAX — the two lanes detonate together",
      "cats": [],
      "clusters": [["nyles", "sarah"], ["roy"], ["tala", "abe"], ["howard"], ["misty"]]
    },
    {
      "name": "THE NEXT MORNING",
      "loc": "the coda",
      "cap": ["They wake in the desert and the wedding is over",
              "The day has finally moved on, and so have they"],
      "tag": "CODA — the loop breaks, the day ends",
      "cats": ["ebert"],
      "clusters": [["nyles", "sarah"]]
    }
  ]
}
