{
 "slug": "sliding-doors",
 "title": "Sliding Doors",
 "year": 1998,
 "runtime_min": 99,
 "score": 25,
 "score_note": "the premise is the structure: the tube doors ARE the meet-cute",
 "order": [
  "helen",
  "gerry",
  "james",
  "lydia",
  "anna"
 ],
 "chars": [
  {
   "id": "helen",
   "name": "Helen",
   "width": 32,
   "colour": "#1b57c4"
  },
  {
   "id": "gerry",
   "name": "Gerry",
   "width": 26,
   "colour": "#9c6552"
  },
  {
   "id": "james",
   "name": "James",
   "width": 26,
   "colour": "#d0316a"
  },
  {
   "id": "lydia",
   "name": "Lydia",
   "width": 18,
   "colour": "#8d7fa8"
  },
  {
   "id": "anna",
   "name": "Anna",
   "width": 16,
   "colour": "#6e9078"
  }
 ],
 "beats": [
  {
   "name": "THE DOORS",
   "loc": "≈ 0–8 min",
   "cap": [
    "she is fired from one job and loses",
    "a second; the tube doors close"
   ],
   "tag": "the premise arrives in one beat",
   "cats": [
    "meet"
   ],
   "clusters": [
    [
     "helen"
    ],
    [
     "gerry"
    ],
    [
     "lydia"
    ],
    [
     "james"
    ],
    [
     "anna"
    ]
   ]
  },
  {
   "name": "SHE CATCHES IT",
   "loc": "≈ 8–20 min",
   "cap": [
    "in one line she gets home early,",
    "in the other she is later than she knows"
   ],
   "tag": "the film splits and never says so",
   "cats": [],
   "clusters": [
    [
     "helen",
     "james"
    ],
    [
     "gerry",
     "lydia"
    ],
    [
     "anna"
    ]
   ]
  },
  {
   "name": "SHE MISSES IT",
   "loc": "≈ 8–20 min",
   "cap": [
    "the other Helen takes the next train,",
    "is hurt, and goes to hospital"
   ],
   "tag": "the same beat, the other life",
   "cats": [],
   "clusters": [
    [
     "helen"
    ],
    [
     "gerry"
    ],
    [
     "lydia"
    ],
    [
     "james"
    ],
    [
     "anna"
    ]
   ]
  },
  {
   "name": "TWO FLATS, ONE LIE",
   "loc": "≈ 20–35 min",
   "cap": [
    "Gerry is cheating in both lines;",
    "only one Helen finds out tonight"
   ],
   "tag": "the discovery is the story",
   "cats": [],
   "clusters": [
    [
     "helen",
     "james"
    ],
    [
     "gerry",
     "lydia"
    ]
   ]
  },
  {
   "name": "THE FRIEND'S CAFE",
   "loc": "≈ 35–48 min",
   "cap": [
    "Anna keeps her honest in one line;",
    "in the other she has nobody to tell"
   ],
   "tag": "the best friend, doing the work",
   "cats": [
    "bff"
   ],
   "clusters": [
    [
     "helen",
     "anna"
    ],
    [
     "james"
    ],
    [
     "gerry",
     "lydia"
    ]
   ]
  },
  {
   "name": "THE NEW ONE",
   "loc": "≈ 48–62 min",
   "cap": [
    "James in this line, Gerry's pity in the",
    "other, which is not the line pictured here"
   ],
   "tag": "the same woman, two men",
   "cats": [],
   "clusters": [
    [
     "helen",
     "james"
    ],
    [
     "gerry"
    ],
    [
     "lydia"
    ]
   ]
  },
  {
   "name": "PREGNANT",
   "loc": "≈ 62–72 min",
   "cap": [
    "this Helen is pregnant and planning;",
    "the other is alone, off to the right"
   ],
   "tag": "two futures from one morning",
   "cats": [],
   "clusters": [
    [
     "helen",
     "gerry"
    ],
    [
     "james"
    ],
    [
     "lydia"
    ]
   ]
  },
  {
   "name": "THE STAIRS",
   "loc": "≈ 72–82 min",
   "cap": [
    "the hospital, the fall, the thing",
    "neither version of her saw coming"
   ],
   "tag": "the dark night, twice",
   "cats": [],
   "clusters": [
    [
     "helen"
    ],
    [
     "james"
    ],
    [
     "gerry",
     "lydia"
    ],
    [
     "anna"
    ]
   ]
  },
  {
   "name": "ONE HELEN",
   "loc": "≈ 82–92 min",
   "cap": [
    "the lines end in the same corridor,",
    "and only one of her walks out of it"
   ],
   "tag": "the film's cruelest cut",
   "cats": [],
   "clusters": [
    [
     "helen",
     "james"
    ],
    [
     "anna"
    ],
    [
     "gerry"
    ],
    [
     "lydia"
    ]
   ]
  },
  {
   "name": "THE LIFT",
   "loc": "the coda",
   "cap": [
    "she meets James on the way up,",
    "in the life she gets to keep"
   ],
   "tag": "GESTURE — the meeting, earned",
   "cats": [
    "gesture",
    "ebert"
   ],
   "clusters": [
    [
     "helen",
     "james"
    ],
    [
     "anna"
    ]
   ]
  }
 ]
}
